{
  "candidateId": "SEM3-EVAL-CAND-COMP-D02C7BE3EF1E0FA2DB9D",
  "caseId": "SEM3-BLIND-EPILEPSY-DISCORDANT-REGION-ELLIPSIS",
  "clarification": {
    "adjudicationRequired": false,
    "evidenceRefs": [
      "candidate.executionStatus"
    ],
    "status": "NOT_EVALUABLE"
  },
  "contractType": "BENCHMARK_EVALUATION_RESULT",
  "criticalViolations": [],
  "disposition": "NOT_EVALUABLE",
  "enrichment": {
    "adjudicationRequired": false,
    "evidenceRefs": [
      "candidate.executionStatus"
    ],
    "status": "NOT_EVALUABLE"
  },
  "equivalence": {
    "classification": "NOT_ASSESSED",
    "referenceVariantId": null,
    "requiresHumanDecision": false,
    "requiresIndependentQualificationEvidence": false,
    "structureProfile": "NOT_AVAILABLE"
  },
  "evaluationId": "SEM3-EVAL-COMP-D02C7BE3EF1E0FA2DB9D",
  "evaluatorIdentity": {
    "configurationDigest": "0d0f48cf1859d3747fd17eeaf75d51a59e6a5d5a48a096beab67cbe32d94665b",
    "version": "1.3.0"
  },
  "evidenceTrace": [
    "SEM3-BLIND-EPILEPSY-DISCORDANT-REGION-ELLIPSIS@1.0.0",
    "SEM3-AE-BLIND-EPILEPSY-DISCORDANT-REGION-ELLIPSIS@1.0.0",
    "SEM3-EVAL-CAND-COMP-D02C7BE3EF1E0FA2DB9D@1.3.0",
    "candidate.executionStatus"
  ],
  "findings": [
    {
      "code": "CANDIDATE_OUTPUT_NOT_EVALUABLE",
      "downstreamOf": null,
      "failureClass": "QUALIFICATION_PROTOCOL_FAILURE",
      "findingId": "finding-001-candidate-executionstatus",
      "isFirstCause": true,
      "message": "The candidate output is explicitly unavailable for a scientifically defensible judgment.",
      "propertyIds": [],
      "referenceId": "candidate.executionStatus",
      "stage": "EXECUTION"
    },
    {
      "code": "REQUIRED_OBLIGATION_NOT_EVALUABLE",
      "downstreamOf": "finding-001-candidate-executionstatus",
      "failureClass": "QUALIFICATION_PROTOCOL_FAILURE",
      "findingId": "finding-002-req-1-epileptogenic-network-purpose",
      "isFirstCause": false,
      "message": "A required obligation has no evaluable normalized mapping.",
      "propertyIds": [
        "PROPERTY_EXPLICIT_CONTENT_PRESERVED"
      ],
      "referenceId": "req-1-epileptogenic-network-purpose",
      "stage": "LEVEL_1"
    },
    {
      "code": "REQUIRED_OBLIGATION_NOT_EVALUABLE",
      "downstreamOf": "finding-001-candidate-executionstatus",
      "failureClass": "QUALIFICATION_PROTOCOL_FAILURE",
      "findingId": "finding-003-req-2-pet-and-meg",
      "isFirstCause": false,
      "message": "A required obligation has no evaluable normalized mapping.",
      "propertyIds": [
        "PROPERTY_EXPLICIT_CONTENT_PRESERVED",
        "PROPERTY_EXPLICIT_RELATIONS_PRESERVED",
        "PROPERTY_CONCEPTUAL_PLAN_SEPARATION"
      ],
      "referenceId": "req-2-pet-and-meg",
      "stage": "LEVEL_1"
    },
    {
      "code": "REQUIRED_OBLIGATION_NOT_EVALUABLE",
      "downstreamOf": "finding-001-candidate-executionstatus",
      "failureClass": "QUALIFICATION_PROTOCOL_FAILURE",
      "findingId": "finding-004-req-3-regional-discordance-possible",
      "isFirstCause": false,
      "message": "A required obligation has no evaluable normalized mapping.",
      "propertyIds": [
        "PROPERTY_AMBIGUITY_AND_UNKNOWN_PRESERVED"
      ],
      "referenceId": "req-3-regional-discordance-possible",
      "stage": "LEVEL_1"
    },
    {
      "code": "REQUIRED_OBLIGATION_NOT_EVALUABLE",
      "downstreamOf": "finding-001-candidate-executionstatus",
      "failureClass": "QUALIFICATION_PROTOCOL_FAILURE",
      "findingId": "finding-005-req-4-concordant-primary-candidate",
      "isFirstCause": false,
      "message": "A required obligation has no evaluable normalized mapping.",
      "propertyIds": [
        "PROPERTY_POLARITY_AND_CONDITIONALITY_PRESERVED",
        "PROPERTY_CONTEXTUAL_INFERENCE_NOT_USER_FACT",
        "PROPERTY_OWNER_AND_ADOPTION_BOUNDARIES_PRESERVED"
      ],
      "referenceId": "req-4-concordant-primary-candidate",
      "stage": "LEVEL_1"
    },
    {
      "code": "REQUIRED_OBLIGATION_NOT_EVALUABLE",
      "downstreamOf": "finding-001-candidate-executionstatus",
      "failureClass": "QUALIFICATION_PROTOCOL_FAILURE",
      "findingId": "finding-006-req-5-discordant-region-separate",
      "isFirstCause": false,
      "message": "A required obligation has no evaluable normalized mapping.",
      "propertyIds": [
        "PROPERTY_EXPLICIT_CONTENT_PRESERVED",
        "PROPERTY_EXPLICIT_RELATIONS_PRESERVED",
        "PROPERTY_PROVENANCE_RECONSTRUCTIBLE"
      ],
      "referenceId": "req-5-discordant-region-separate",
      "stage": "LEVEL_1"
    },
    {
      "code": "PROHIBITION_NOT_EVALUABLE",
      "downstreamOf": "finding-001-candidate-executionstatus",
      "failureClass": "QUALIFICATION_PROTOCOL_FAILURE",
      "findingId": "finding-007-pro-1-candidate-certain-focus",
      "isFirstCause": false,
      "message": "A prohibited condition has no evaluable normalized signal.",
      "propertyIds": [
        "PROPERTY_CONTEXTUAL_INFERENCE_NOT_USER_FACT",
        "PROPERTY_KNOWLEDGE_SUPPORT_NOT_PROJECT_TRUTH",
        "PROPERTY_OWNER_AND_ADOPTION_BOUNDARIES_PRESERVED"
      ],
      "referenceId": "pro-1-candidate-certain-focus",
      "stage": "LEVEL_1"
    },
    {
      "code": "PROHIBITION_NOT_EVALUABLE",
      "downstreamOf": "finding-001-candidate-executionstatus",
      "failureClass": "QUALIFICATION_PROTOCOL_FAILURE",
      "findingId": "finding-008-pro-2-merge-regions",
      "isFirstCause": false,
      "message": "A prohibited condition has no evaluable normalized signal.",
      "propertyIds": [
        "PROPERTY_EXPLICIT_RELATIONS_PRESERVED",
        "PROPERTY_AMBIGUITY_AND_UNKNOWN_PRESERVED"
      ],
      "referenceId": "pro-2-merge-regions",
      "stage": "LEVEL_1"
    },
    {
      "code": "PROHIBITION_NOT_EVALUABLE",
      "downstreamOf": "finding-001-candidate-executionstatus",
      "failureClass": "QUALIFICATION_PROTOCOL_FAILURE",
      "findingId": "finding-009-pro-3-wrong-ellipsis-antecedent",
      "isFirstCause": false,
      "message": "A prohibited condition has no evaluable normalized signal.",
      "propertyIds": [
        "PROPERTY_EXPLICIT_RELATIONS_PRESERVED",
        "PROPERTY_PROVENANCE_RECONSTRUCTIBLE"
      ],
      "referenceId": "pro-3-wrong-ellipsis-antecedent",
      "stage": "LEVEL_1"
    }
  ],
  "firstCause": {
    "code": "CANDIDATE_OUTPUT_NOT_EVALUABLE",
    "downstreamOf": null,
    "failureClass": "QUALIFICATION_PROTOCOL_FAILURE",
    "findingId": "finding-001-candidate-executionstatus",
    "isFirstCause": true,
    "message": "The candidate output is explicitly unavailable for a scientifically defensible judgment.",
    "propertyIds": [],
    "referenceId": "candidate.executionStatus",
    "stage": "EXECUTION"
  },
  "level1": {
    "checkCount": 8,
    "criticalVector": [
      {
        "judgment": "NOT_EVALUABLE",
        "propertyId": "PROPERTY_EXPLICIT_CONTENT_PRESERVED"
      },
      {
        "judgment": "NOT_EVALUABLE",
        "propertyId": "PROPERTY_EXPLICIT_RELATIONS_PRESERVED"
      },
      {
        "judgment": "NOT_EVALUABLE",
        "propertyId": "PROPERTY_POLARITY_AND_CONDITIONALITY_PRESERVED"
      },
      {
        "judgment": "NOT_APPLICABLE",
        "propertyId": "PROPERTY_COMPARISON_AND_TIMING_PRESERVED"
      },
      {
        "judgment": "NOT_APPLICABLE",
        "propertyId": "PROPERTY_CORRECTION_PROPAGATED_WITH_HISTORY"
      },
      {
        "judgment": "NOT_APPLICABLE",
        "propertyId": "PROPERTY_NO_UNSUPPORTED_CAUSAL_PROMOTION"
      },
      {
        "judgment": "NOT_EVALUABLE",
        "propertyId": "PROPERTY_CONTEXTUAL_INFERENCE_NOT_USER_FACT"
      },
      {
        "judgment": "NOT_EVALUABLE",
        "propertyId": "PROPERTY_KNOWLEDGE_SUPPORT_NOT_PROJECT_TRUTH"
      },
      {
        "judgment": "NOT_EVALUABLE",
        "propertyId": "PROPERTY_AMBIGUITY_AND_UNKNOWN_PRESERVED"
      },
      {
        "judgment": "NOT_EVALUABLE",
        "propertyId": "PROPERTY_NO_UNSUPPORTED_INVENTION"
      },
      {
        "judgment": "NOT_EVALUABLE",
        "propertyId": "PROPERTY_OWNER_AND_ADOPTION_BOUNDARIES_PRESERVED"
      },
      {
        "judgment": "NOT_EVALUABLE",
        "propertyId": "PROPERTY_PROVENANCE_RECONSTRUCTIBLE"
      }
    ],
    "status": "NOT_EVALUABLE"
  },
  "level2": {
    "adjudicationPackets": [],
    "appliedDecisions": [],
    "status": "NOT_EVALUABLE"
  },
  "mode": "FUTURE_SEM_RUNTIME",
  "ownership": {
    "adjudicationRequired": false,
    "evidenceRefs": [
      "candidate.executionStatus"
    ],
    "status": "NOT_EVALUABLE"
  },
  "propertyJudgments": [
    {
      "adjudicationPacketId": null,
      "alias": "P01",
      "applicable": true,
      "checkType": "DETERMINISTIC_CHECK",
      "compensable": false,
      "downstreamFindings": [],
      "evaluationScope": "ABSOLUTE_RUN_LEVEL",
      "evidenceTrace": [
        "candidate.executionStatus"
      ],
      "failureClass": "EXPLICIT_FIDELITY_FAILURE",
      "family": "SAFETY_FIDELITY_INVARIANT",
      "firstCause": null,
      "judgment": "NOT_EVALUABLE",
      "propertyId": "PROPERTY_EXPLICIT_CONTENT_PRESERVED"
    },
    {
      "adjudicationPacketId": null,
      "alias": "P02",
      "applicable": true,
      "checkType": "DETERMINISTIC_CHECK",
      "compensable": false,
      "downstreamFindings": [],
      "evaluationScope": "ABSOLUTE_RUN_LEVEL",
      "evidenceTrace": [
        "candidate.executionStatus"
      ],
      "failureClass": "RELATION_SEMANTICS_FAILURE",
      "family": "SAFETY_FIDELITY_INVARIANT",
      "firstCause": null,
      "judgment": "NOT_EVALUABLE",
      "propertyId": "PROPERTY_EXPLICIT_RELATIONS_PRESERVED"
    },
    {
      "adjudicationPacketId": null,
      "alias": "P03",
      "applicable": true,
      "checkType": "DETERMINISTIC_CHECK",
      "compensable": false,
      "downstreamFindings": [],
      "evaluationScope": "ABSOLUTE_RUN_LEVEL",
      "evidenceTrace": [
        "candidate.executionStatus"
      ],